Accession_Number,DOI,Pubmed_ID,Article_Title,Link,Authors,Source,Research_Area,Document Type,Volume,Issue,Pages,Publication_Date,Times_Cited,Journal_Expected_Citations,Category_Expected_Citations,Journal_Normalized_Citation_Impact,Category_Normalized_Citation_Impact,Percentile_in_Subject_Area,Journal_Impact_Factor
WOS:000285666200023,10.2337/dc10-0994,MEDLINE:20807870,"Magnesium Intake in Relation to Systemic Inflammation, Insulin Resistance, and the Incidence of Diabetes",https://gateway.webofknowledge.com/gateway/Gateway.cgi?GWVersion=2&SrcAuth=InCites&SrcApp=tsm_test&DestApp=WOS_CPL&DestLinkType=FullRecord&KeyUT=ISI:000285666200023,"Kim, Dae Jung; Xun, Pengcheng; Liu, Kiang; Loria, Catherine; Yokota, Kuninobu; Jacobs, David R., Jr.; He, Ka",DIABETES CARE,ENDOCRINOLOGY & METABOLISM,Article,33,12,2604-2610,2010,95,71.829615,32.96,1.32,2.8819,6.0238,16.019
WOS:000282234100036,10.3945/ajcn.2010.29478,MEDLINE:20702604,Drinking caloric beverages increases the risk of adverse cardiometabolic outcomes in the Coronary Artery Risk Development in Young Adults (CARDIA) Study,https://gateway.webofknowledge.com/gateway/Gateway.cgi?GWVersion=2&SrcAuth=InCites&SrcApp=tsm_test&DestApp=WOS_CPL&DestLinkType=FullRecord&KeyUT=ISI:000282234100036,"Duffey, Kiyah J.; Gordon-Larsen, Penny; Steffen, Lyn M.; Jacobs, David R., Jr.; Popkin, Barry M.",AMERICAN JOURNAL OF CLINICAL NUTRITION,NUTRITION & DIETETICS,Article,92,4,954-959,2010,105,73.156085,28.73,1.44,3.6549,3.933,6.766
WOS:000284234100011,10.1016/j.amepre.2010.08.008,MEDLINE:21084075,Prevalence and Predictors of Weight-Loss Maintenance in a Biracial Cohort Results from the Coronary Artery Risk Development in Young Adults Study,https://gateway.webofknowledge.com/gateway/Gateway.cgi?GWVersion=2&SrcAuth=InCites&SrcApp=tsm_test&DestApp=WOS_CPL&DestLinkType=FullRecord&KeyUT=ISI:000284234100011,"Phelan, Suzanne; Wing, Rena R.; Loria, Catherine M.; Kim, Yongin; Lewis, Cora E.",AMERICAN JOURNAL OF PREVENTIVE MEDICINE,"PUBLIC, ENVIRONMENTAL & OCCUPATIONAL HEALTH",Article,39,6,546-554,2010,35,44.873874,21.58,0.78,1.6222,16.5967,4.42
WOS:000275678400002,10.1159/000268955,MEDLINE:20029176,The Association of African Ancestry and Elevated Creatinine in the Coronary Artery Risk Development in Young Adults (CARDIA) Study,https://gateway.webofknowledge.com/gateway/Gateway.cgi?GWVersion=2&SrcAuth=InCites&SrcApp=tsm_test&DestApp=WOS_CPL&DestLinkType=FullRecord&KeyUT=ISI:000275678400002,"Peralta, Carmen A.; Risch, Neil; Lin, Feng; Shlipak, Michael G.; Reiner, Alex; Ziv, Elad; Tang, Hua; Siscovick, David; Bibbins-Domingo, Kirsten",AMERICAN JOURNAL OF NEPHROLOGY,UROLOGY & NEPHROLOGY,Article,31,3,202-208,2010,16,22.577236,22.61,0.71,0.7076,40.7806,3.411
WOS:000282234100015,10.3945/ajcn.2010.29161,MEDLINE:20685947,Diet quality and weight gain among black and white young adults: the Coronary Artery Risk Development in Young Adults (CARDIA) Study (1985-2005),https://gateway.webofknowledge.com/gateway/Gateway.cgi?GWVersion=2&SrcAuth=InCites&SrcApp=tsm_test&DestApp=WOS_CPL&DestLinkType=FullRecord&KeyUT=ISI:000282234100015,"Zamora, Daisy; Gordon-Larsen, Penny; Jacobs, David R., Jr.; Popkin, Barry M.",AMERICAN JOURNAL OF CLINICAL NUTRITION,NUTRITION & DIETETICS,Article,92,4,784-793,2010,50,73.156085,28.73,0.68,1.7404,15.9373,6.766
WOS:000281882800028,10.1161/ATVBAHA.110.208280,MEDLINE:20616310,"Coffee, Decaffeinated Coffee, Caffeine, and Tea Consumption in Young Adulthood and Atherosclerosis Later in Life The CARDIA Study",https://gateway.webofknowledge.com/gateway/Gateway.cgi?GWVersion=2&SrcAuth=InCites&SrcApp=tsm_test&DestApp=WOS_CPL&DestLinkType=FullRecord&KeyUT=ISI:000281882800028,"Reis, Jared P.; Loria, Catherine M.; Steffen, Lyn M.; Zhou, Xia; Van Horn, Linda; Siscovick, David S.; Jacobs, David R., Jr.; Carr, J. Jeffrey",ARTERIOSCLEROSIS THROMBOSIS AND VASCULAR BIOLOGY,PERIPHERAL VASCULAR DISEASE; HEMATOLOGY,Article,30,10,2059-2066,2010,32,57.372781,34.74,0.56,0.9212,30.9421,6.604
WOS:000284937600001,10.1155/2010/726071,MEDLINE:20049158,Gender Differences in the Association between Sleep Duration and Body Composition: The Cardia Study,https://gateway.webofknowledge.com/gateway/Gateway.cgi?GWVersion=2&SrcAuth=InCites&SrcApp=tsm_test&DestApp=WOS_CPL&DestLinkType=FullRecord&KeyUT=ISI:000284937600001,"St-Onge, Marie-Pierre; Perumean-Chaney, Suzanne; Desmond, Renee; Lewis, Cora E.; Yan, Lijing L.; Person, Sharina D.; Allison, David B.",INTERNATIONAL JOURNAL OF ENDOCRINOLOGY,ENDOCRINOLOGY & METABOLISM,Article,n/a,n/a,n/a,2010,39,21.441176,32.96,1.82,1.1831,25.1759,2.299
WOS:000281949100018,10.1093/aje/kwq237,n/a,"RE: ""ALCOHOL CONSUMPTION IN YOUNG ADULTS AND INCIDENT HYPERTENSION: 20-YEAR FOLLOW-UP FROM THE CORONARY ARTERY RISK DEVELOPMENT IN YOUNG ADULTS STUDY'' REPLY",https://gateway.webofknowledge.com/gateway/Gateway.cgi?GWVersion=2&SrcAuth=InCites&SrcApp=tsm_test&DestApp=WOS_CPL&DestLinkType=FullRecord&KeyUT=ISI:000281949100018,"Halanych, Jewell H.; Safford, Monika M.; Kertesz, Stefan G.; Person, Sharina D.; Kiefe, Catarina I.",AMERICAN JOURNAL OF EPIDEMIOLOGY,"PUBLIC, ENVIRONMENTAL & OCCUPATIONAL HEALTH",Letter,172,6,744-745,2010,0,1.34375,2.79,0,0,100,4.526
WOS:000280652400022,10.1210/jc.2009-2028,MEDLINE:20501685,Prepregnancy Lipids Related to Preterm Birth Risk: The Coronary Artery Risk Development in Young Adults Study,https://gateway.webofknowledge.com/gateway/Gateway.cgi?GWVersion=2&SrcAuth=InCites&SrcApp=tsm_test&DestApp=WOS_CPL&DestLinkType=FullRecord&KeyUT=ISI:000280652400022,"Catov, Janet M.; Ness, Roberta B.; Wellons, Melissa F.; Jacobs, David R.; Roberts, James M.; Gunderson, Erica P.",JOURNAL OF CLINICAL ENDOCRINOLOGY & METABOLISM,ENDOCRINOLOGY & METABOLISM,Article,95,8,3711-3718,2010,45,56.017266,32.96,0.8,1.3651,20.7188,5.399
WOS:000280985700002,10.1111/j.1469-1809.2010.00596.x,MEDLINE:20642810,"Candidate Molecular Pathway Genes Related to Appetite Regulatory Neural Network, Adipocyte Homeostasis and Obesity: Results from the CARDIA Study",https://gateway.webofknowledge.com/gateway/Gateway.cgi?GWVersion=2&SrcAuth=InCites&SrcApp=tsm_test&DestApp=WOS_CPL&DestLinkType=FullRecord&KeyUT=ISI:000280985700002,"Friedlander, Yechiel; Li, Guo; Fornage, Myriam; Williams, O. Dale; Lewis, Cora E.; Schreiner, Pamela; Pletcher, Mark J.; Enquobahrie, Daniel; Williams, Michelle; Siscovick, David S.",ANNALS OF HUMAN GENETICS,GENETICS & HEREDITY,Article,74,n/a,387-398,2010,11,15.303571,37.5,0.72,0.2933,66.0493,1.368
WOS:000281640300060,10.1210/jc.2009-2643,MEDLINE:20554712,"Prospective Association of Serum Androgens and Sex Hormone-Binding Globulin with Subclinical Cardiovascular Disease in Young Adult Women: The ""Coronary Artery Risk Development in Young Adults"" Women's Study",https://gateway.webofknowledge.com/gateway/Gateway.cgi?GWVersion=2&SrcAuth=InCites&SrcApp=tsm_test&DestApp=WOS_CPL&DestLinkType=FullRecord&KeyUT=ISI:000281640300060,"Calderon-Margalit, R.; Schwartz, S. M.; Wellons, M. F.; Lewis, C. E.; Daviglus, M. L.; Schreiner, P. J.; Williams, O. D.; Sternfeld, B.; Carr, J. J.; O'Leary, D. H.; Sidney, S.; Friedlander, Y.; Siscovick, D. S.",JOURNAL OF CLINICAL ENDOCRINOLOGY & METABOLISM,ENDOCRINOLOGY & METABOLISM,Article,95,9,4424-4431,2010,40,56.017266,32.96,0.71,1.2134,24.3829,5.399
WOS:000280531100007,10.1093/aje/kwq098,MEDLINE:20610467,Do Neighborhood Socioeconomic Deprivation and Low Social Cohesion Predict Coronary Calcification?,https://gateway.webofknowledge.com/gateway/Gateway.cgi?GWVersion=2&SrcAuth=InCites&SrcApp=tsm_test&DestApp=WOS_CPL&DestLinkType=FullRecord&KeyUT=ISI:000280531100007,"Kim, Daniel; Roux, Ana V. Diez; Kiefe, Catarina I.; Kawachi, Ichiro; Liu, Kiang",AMERICAN JOURNAL OF EPIDEMIOLOGY,"PUBLIC, ENVIRONMENTAL & OCCUPATIONAL HEALTH",Article,172,3,288-298,2010,48,53.30038,21.58,0.9,2.2247,10.0686,4.526
WOS:000292658100004,10.1001/archinternmed.2011.283,MEDLINE:21747011,Fast Food Restaurants and Food Stores Longitudinal Associations With Diet in Young to Middle-aged Adults: The CARDIA Study,https://gateway.webofknowledge.com/gateway/Gateway.cgi?GWVersion=2&SrcAuth=InCites&SrcApp=tsm_test&DestApp=WOS_CPL&DestLinkType=FullRecord&KeyUT=ISI:000292658100004,"Boone-Heinonen, Janne; Gordon-Larsen, Penny; Kiefe, Catarina I.; Shikany, James M.; Lewis, Cora E.; Popkin, Barry M.",ARCHIVES OF INTERNAL MEDICINE,"PUBLIC, ENVIRONMENTAL & OCCUPATIONAL HEALTH",Article,171,13,1162-1170,2011,215,77.08642,19.48,2.79,11.0345,0.4524,n/a
WOS:000290062000014,10.1016/j.ypmed.2011.02.007,MEDLINE:21338621,Longitudinal trends in gasoline price and physical activity: The CARDIA study,https://gateway.webofknowledge.com/gateway/Gateway.cgi?GWVersion=2&SrcAuth=InCites&SrcApp=tsm_test&DestApp=WOS_CPL&DestLinkType=FullRecord&KeyUT=ISI:000290062000014,"Hou, Ningqi; Popkin, Barry M.; Jacobs, David R., Jr.; Song, Yan; Guilkey, David K.; He, Ka; Lewis, Cora E.; Gordon-Larsen, Penny",PREVENTIVE MEDICINE,"PUBLIC, ENVIRONMENTAL & OCCUPATIONAL HEALTH",Article,52,5,365-369,2011,20,29.16185,19.48,0.69,1.0265,28.2669,3.788
WOS:000292924900005,10.3945/ajcn.110.008995,MEDLINE:21653799,Fat mass modifies the association of fat-free mass with symptom-limited treadmill duration in the Coronary Artery Risk Development in Young Adults (CARDIA) Study,https://gateway.webofknowledge.com/gateway/Gateway.cgi?GWVersion=2&SrcAuth=InCites&SrcApp=tsm_test&DestApp=WOS_CPL&DestLinkType=FullRecord&KeyUT=ISI:000292924900005,"Zhu, Na; Jacobs, David R., Jr.; Sidney, Stephen; Sternfeld, Barbara; Carnethon, Mercedes; Lewis, Cora E.; Shay, Christina M.; Sood, Akshay; Bouchard, Claude",AMERICAN JOURNAL OF CLINICAL NUTRITION,NUTRITION & DIETETICS,Article,94,2,385-391,2011,8,59.903226,25.07,0.13,0.3191,70.1054,6.766
WOS:000296697900018,10.1038/oby.2011.113,MEDLINE:21617639,Lower Extremity Fat Mass Is Associated With Insulin Resistance in Overweight and Obese Individuals: The CARDIA Study,https://gateway.webofknowledge.com/gateway/Gateway.cgi?GWVersion=2&SrcAuth=InCites&SrcApp=tsm_test&DestApp=WOS_CPL&DestLinkType=FullRecord&KeyUT=ISI:000296697900018,"Shay, Christina M.; Carnethon, Mercedes R.; Church, Timothy R.; Hankinson, Arlene L.; Chan, Cheeling; Jacobs, David R., Jr.; Lewis, Cora E.; Schreiner, Pamela J.; Sternfeld, Barbara; Sidney, Stephen",OBESITY,NUTRITION & DIETETICS; ENDOCRINOLOGY & METABOLISM,Article,19,11,2248-2253,2011,8,37.343109,27.1,0.21,0.2952,70.1054,3.742
WOS:000290419200020,10.2337/dc10-1962,MEDLINE:21411507,Cross-Sectional Associations Between Measures of Sleep and Markers of Glucose Metabolism Among Subjects With and Without Diabetes The Coronary Artery Risk Development in Young Adults (CARDIA) Sleep Study,https://gateway.webofknowledge.com/gateway/Gateway.cgi?GWVersion=2&SrcAuth=InCites&SrcApp=tsm_test&DestApp=WOS_CPL&DestLinkType=FullRecord&KeyUT=ISI:000290419200020,"Knutson, Kristen L.; Van Cauter, Eve; Zee, Phyllis; Liu, Kiang; Lauderdale, Diane S.",DIABETES CARE,ENDOCRINOLOGY & METABOLISM,Article,34,5,1171-1176,2011,119,64.982558,29.48,1.83,4.0372,3.1022,16.019
WOS:000288435400015,10.1089/jwh.2010.2303,MEDLINE:21323584,Socioeconomic Status and Polycystic Ovary Syndrome,https://gateway.webofknowledge.com/gateway/Gateway.cgi?GWVersion=2&SrcAuth=InCites&SrcApp=tsm_test&DestApp=WOS_CPL&DestLinkType=FullRecord&KeyUT=ISI:000288435400015,"Merkin, Sharon Stein; Azziz, Ricardo; Seeman, Teresa; Calderon-Margalit, Ronit; Daviglus, Martha; Kiefe, Catarina; Matthews, Karen; Sternfeld, Barbara; Siscovick, David",JOURNAL OF WOMENS HEALTH,"Women's Studies; OBSTETRICS & GYNECOLOGY; PUBLIC, ENVIRONMENTAL & OCCUPATIONAL HEALTH",Article,20,3,413-419,2011,14,18.593458,12.79,0.75,1.0943,19.3526,1.933
WOS:000291467100011,10.1136/jech.2009.102228,MEDLINE:20713371,Heavy drinking in early adulthood and outcomes at mid life,https://gateway.webofknowledge.com/gateway/Gateway.cgi?GWVersion=2&SrcAuth=InCites&SrcApp=tsm_test&DestApp=WOS_CPL&DestLinkType=FullRecord&KeyUT=ISI:000291467100011,"Sloan, F. A.; Costanzo, P. R.; Belsky, D.; Holmberg, E.; Malone, P. S.; Wang, Y.; Kertesz, S.",JOURNAL OF EPIDEMIOLOGY AND COMMUNITY HEALTH,"PUBLIC, ENVIRONMENTAL & OCCUPATIONAL HEALTH",Article,65,7,600-605,2011,9,27.19883,19.48,0.33,0.4619,55.5464,3.342
WOS:000293025000013,10.1093/cid/cir378,MEDLINE:21765079,Racial Differences in Tuberculosis Infection in United States Communities: The Coronary Artery Risk Development in Young Adults Study,https://gateway.webofknowledge.com/gateway/Gateway.cgi?GWVersion=2&SrcAuth=InCites&SrcApp=tsm_test&DestApp=WOS_CPL&DestLinkType=FullRecord&KeyUT=ISI:000293025000013,"Nahid, Payam; Horne, David J.; Jarlsberg, Leah G.; Reiner, Alexander P.; Osmond, Dennis; Hopewell, Philip C.; Bibbins-Domingo, Kirsten",CLINICAL INFECTIOUS DISEASES,INFECTIOUS DISEASES; MICROBIOLOGY; IMMUNOLOGY,Article,53,3,291-294,2011,9,70.519789,27.53,0.13,0.3269,66.6929,8.313
WOS:000296236100009,10.3945/ajcn.111.019067,MEDLINE:21918220,Serum carotenoid concentrations predict lung function evolution in young adults: the Coronary Artery Risk Development in Young Adults (CARDIA) Study,https://gateway.webofknowledge.com/gateway/Gateway.cgi?GWVersion=2&SrcAuth=InCites&SrcApp=tsm_test&DestApp=WOS_CPL&DestLinkType=FullRecord&KeyUT=ISI:000296236100009,"Thyagarajan, Bharat; Meyer, Katie A.; Smith, Lewis J.; Beckett, William S.; Williams, O. Dale; Gross, Myron D.; Jacobs, David R., Jr.",AMERICAN JOURNAL OF CLINICAL NUTRITION,NUTRITION & DIETETICS,Article,94,5,1211-1218,2011,14,59.903226,25.07,0.23,0.5584,53.707,6.766
WOS:000287979000008,10.1016/j.jash.2010.12.002,MEDLINE:21269909,Diurnal blood pressure pattern and development of prehypertension or hypertension in young adults: the CARINA study,https://gateway.webofknowledge.com/gateway/Gateway.cgi?GWVersion=2&SrcAuth=InCites&SrcApp=tsm_test&DestApp=WOS_CPL&DestLinkType=FullRecord&KeyUT=ISI:000287979000008,"Viera, Anthony J.; Zhu, Sha; Hinderliter, Alan L.; Shimbo, Daichi; Person, Sharina D.; Jacobs, David R., Jr.",JOURNAL OF THE AMERICAN SOCIETY OF HYPERTENSION,PERIPHERAL VASCULAR DISEASE,Article,5,1,48-55,2011,19,18.473684,31.17,1.03,0.6095,44.4383,n/a
WOS:000287133900056,10.1016/j.juro.2010.10.086,MEDLINE:21251678,Kidney Stones and Subclinical Atherosclerosis in Young Adults: The CARDIA Study,https://gateway.webofknowledge.com/gateway/Gateway.cgi?GWVersion=2&SrcAuth=InCites&SrcApp=tsm_test&DestApp=WOS_CPL&DestLinkType=FullRecord&KeyUT=ISI:000287133900056,"Reiner, Alexander P.; Kahn, Arnold; Eisner, Brian H.; Pletcher, Mark J.; Sadetsky, Natalia; Williams, O. Dale; Polak, Joseph F.; Jacobs, David R., Jr.; Stoller, Marshall L.",JOURNAL OF UROLOGY,UROLOGY & NEPHROLOGY,Article,185,3,920-925,2011,61,30.353033,20.62,2.01,2.9582,6.8501,5.925
WOS:000289162400012,10.1001/jama.2011.397,MEDLINE:21467280,Physical Activity and Weight Gain Over 20 Years,https://gateway.webofknowledge.com/gateway/Gateway.cgi?GWVersion=2&SrcAuth=InCites&SrcApp=tsm_test&DestApp=WOS_CPL&DestLinkType=FullRecord&KeyUT=ISI:000289162400012,"Jolley, Sarah; Porter, Brian; Amory, John",JAMA-JOURNAL OF THE AMERICAN MEDICAL ASSOCIATION,"MEDICINE, GENERAL & INTERNAL",Letter,305,13,1297-1297,2011,0,4.237197,2.99,0,0,100,45.54
WOS:000293952500020,10.1161/HYPERTENSIONAHA.110.168054,MEDLINE:21788603,Association of Sodium and Potassium Intake With Left Ventricular Mass Coronary Artery Risk Development in Young Adults,https://gateway.webofknowledge.com/gateway/Gateway.cgi?GWVersion=2&SrcAuth=InCites&SrcApp=tsm_test&DestApp=WOS_CPL&DestLinkType=FullRecord&KeyUT=ISI:000293952500020,"Rodriguez, Carlos J.; Bibbins-Domingo, Kirsten; Jin, Zhezhen; Daviglus, Martha L.; Goff, David C., Jr.; Jacobs, David R., Jr.",HYPERTENSION,PERIPHERAL VASCULAR DISEASE,Article,58,3,410-U166,2011,29,56.501859,31.17,0.51,0.9303,30.3575,7.713
WOS:000297205700010,10.1097/PSY.0b013e3182365539,MEDLINE:22021461,Occupational Mobility and Carotid Artery Intima-Media Thickness: Findings From the Coronary Artery Risk Development in Young Adults Study,https://gateway.webofknowledge.com/gateway/Gateway.cgi?GWVersion=2&SrcAuth=InCites&SrcApp=tsm_test&DestApp=WOS_CPL&DestLinkType=FullRecord&KeyUT=ISI:000297205700010,"Janicki-Deverts, Denise; Cohen, Sheldon; Matthews, Karen A.; Jacobs, David R.; Adler, Nancy E.",PSYCHOSOMATIC MEDICINE,"PSYCHOLOGY, MULTIDISCIPLINARY; PSYCHOLOGY; PSYCHIATRY",Article,73,9,795-802,2011,7,44.363636,22.73,0.16,0.308,57.2036,3.702
WOS:000285500800003,10.1097/AOG.0b013e31820209bb,MEDLINE:21173640,Polycystic Ovary Syndrome and Risk for Long-Term Diabetes and Dyslipidemia,https://gateway.webofknowledge.com/gateway/Gateway.cgi?GWVersion=2&SrcAuth=InCites&SrcApp=tsm_test&DestApp=WOS_CPL&DestLinkType=FullRecord&KeyUT=ISI:000285500800003,"Wang, Erica T.; Calderon-Margalit, Ronit; Cedars, Marcelle I.; Daviglus, Martha L.; Merkin, Sharon S.; Schreiner, Pamela J.; Sternfeld, Barbara; Wellons, Melissa; Schwartz, Stephen M.; Lewis, Cora E.; Williams, O. Dale; Siscovick, David S.; Bibbins-Domingo, Kirsten",OBSTETRICS AND GYNECOLOGY,OBSTETRICS & GYNECOLOGY,Article,117,1,13-Jun,2011,57,32.891304,16.72,1.73,3.4096,4.7296,5.524
WOS:000286669300012,10.1111/j.1540-8175.2010.01290.x,MEDLINE:21210835,Reference Values of Right Ventricular End-Diastolic Area Defined by Ethnicity and Gender in a Young Adult Population: The CARDIA Study,https://gateway.webofknowledge.com/gateway/Gateway.cgi?GWVersion=2&SrcAuth=InCites&SrcApp=tsm_test&DestApp=WOS_CPL&DestLinkType=FullRecord&KeyUT=ISI:000286669300012,"Ogunyankin, Kofo O.; Liu, Kiang; Lloyd-Jones, Donald M.; Colangelo, Laura A.; Gardin, Julius M.",ECHOCARDIOGRAPHY-A JOURNAL OF CARDIOVASCULAR ULTRASOUND AND ALLIED TECHNIQUES,CARDIAC & CARDIOVASCULAR SYSTEMS,Article,28,2,142-149,2011,13,9.12,25.92,1.43,0.5016,46.5971,1.393
WOS:000285752400013,10.1183/09031936.00193709,MEDLINE:20525713,Lean mass predicts asthma better than fat mass among females,https://gateway.webofknowledge.com/gateway/Gateway.cgi?GWVersion=2&SrcAuth=InCites&SrcApp=tsm_test&DestApp=WOS_CPL&DestLinkType=FullRecord&KeyUT=ISI:000285752400013,"Sood, A.; Qualls, C.; Li, R.; Schuyler, M.; Beckett, W. S.; Smith, L. J.; Thyagarajan, B.; Lewis, C. E.; Jacobs, D. R., Jr.",EUROPEAN RESPIRATORY JOURNAL,RESPIRATORY SYSTEM,Article,37,1,65-71,2011,19,47.728522,25.39,0.4,0.7484,40.2221,12.339
WOS:000292649800011,10.1111/j.1365-2796.2010.02338.x,MEDLINE:21205024,"Fish oil, selenium and mercury in relation to incidence of hypertension: a 20-year follow-up study",https://gateway.webofknowledge.com/gateway/Gateway.cgi?GWVersion=2&SrcAuth=InCites&SrcApp=tsm_test&DestApp=WOS_CPL&DestLinkType=FullRecord&KeyUT=ISI:000292649800011,"Xun, P.; Hou, N.; Daviglus, M.; Liu, K.; Morris, J. S.; Shikany, J. M.; Sidney, S.; Jacobs, D. R.; He, K.",JOURNAL OF INTERNAL MEDICINE,PERIPHERAL VASCULAR DISEASE,Article,270,2,175-186,2011,42,43.275862,31.17,0.97,1.3473,19.7197,6.871
WOS:000209177400055,10.3389/fphar.2011.00055,MEDLINE:22007173,Serum adiponectin is associated with adverse outcomes of asthma in men but not in women,https://gateway.webofknowledge.com/gateway/Gateway.cgi?GWVersion=2&SrcAuth=InCites&SrcApp=tsm_test&DestApp=WOS_CPL&DestLinkType=FullRecord&KeyUT=ISI:000209177400055,"Sood, Akshay; Dominic, Elizabeth; Qualls, Clifford; Steffes, Michael W.; Thyagarajan, Bharat; Smith, Lewis J.; Lewis, Cora E.; Jacobs, David R., Jr.",FRONTIERS IN PHARMACOLOGY,PHARMACOLOGY & PHARMACY,Article,2,n/a,n/a,2011,20,19.818182,20.02,1.01,0.9989,33.8644,4.225
WOS:000295109100022,10.1016/j.socscimed.2011.06.017,MEDLINE:21820224,Indices of socioeconomic position across the life course as predictors of coronary calcification in black and white men and women: Coronary artery risk development in young adults study,https://gateway.webofknowledge.com/gateway/Gateway.cgi?GWVersion=2&SrcAuth=InCites&SrcApp=tsm_test&DestApp=WOS_CPL&DestLinkType=FullRecord&KeyUT=ISI:000295109100022,"Matthews, Karen A.; Schwartz, Joseph E.; Cohen, Sheldon",SOCIAL SCIENCE & MEDICINE,"PUBLIC, ENVIRONMENTAL & OCCUPATIONAL HEALTH; SOCIAL SCIENCES, BIOMEDICAL",Article,73,5,768-774,2011,14,28.982022,18.96,0.48,0.7383,40.4138,3.616
WOS:000289911600002,10.1016/j.socscimed.2010.12.013,MEDLINE:21316829,Neighborhood socioeconomic status predictors of physical activity through young to middle adulthood: The CARDIA study,https://gateway.webofknowledge.com/gateway/Gateway.cgi?GWVersion=2&SrcAuth=InCites&SrcApp=tsm_test&DestApp=WOS_CPL&DestLinkType=FullRecord&KeyUT=ISI:000289911600002,"Boone-Heinonen, Janne; Roux, Ana V. Diez; Kiefe, Catarina I.; Lewis, Cora E.; Guilkey, David K.; Gordon-Larsen, Penny",SOCIAL SCIENCE & MEDICINE,"SOCIAL SCIENCES, BIOMEDICAL; PUBLIC, ENVIRONMENTAL & OCCUPATIONAL HEALTH",Article,72,5,641-649,2011,52,28.982022,18.96,1.79,2.7422,6.2752,3.616
WOS:000285342600009,10.1161/HYPERTENSIONAHA.110.160341,MEDLINE:21135358,Geographic and Demographic Variability in 20-Year Hypertension Incidence The CARDIA Study,https://gateway.webofknowledge.com/gateway/Gateway.cgi?GWVersion=2&SrcAuth=InCites&SrcApp=tsm_test&DestApp=WOS_CPL&DestLinkType=FullRecord&KeyUT=ISI:000285342600009,"Levine, Deborah A.; Lewis, Cora E.; Williams, O. Dale; Safford, Monika M.; Liu, Kiang; Calhoun, David A.; Kim, Yongin; Jacobs, David R., Jr.; Kiefe, Catarina I.",HYPERTENSION,PERIPHERAL VASCULAR DISEASE,Article,57,1,39-U158,2011,42,56.501859,31.17,0.74,1.3473,19.7197,7.713
WOS:000291343600025,10.1016/j.atherosclerosis.2011.02.018,MEDLINE:21392767,Polymorphisms in the ICAM1 gene predict circulating soluble intercellular adhesion molecule-1(sICAM-1),https://gateway.webofknowledge.com/gateway/Gateway.cgi?GWVersion=2&SrcAuth=InCites&SrcApp=tsm_test&DestApp=WOS_CPL&DestLinkType=FullRecord&KeyUT=ISI:000291343600025,"Bielinski, Suzette J.; Reiner, Alex P.; Nickerson, Deborah; Carlson, Chris; Bailey, Kent R.; Thyagarajan, Bharat; Lange, Leslie A.; Boerwinkle, Eric A.; Jacobs, David R., Jr.; Gross, Myron D.",ATHEROSCLEROSIS,CARDIAC & CARDIOVASCULAR SYSTEMS; PERIPHERAL VASCULAR DISEASE,Article,216,2,390-394,2011,22,27.672199,28.3,0.8,0.7773,31.6519,3.919
WOS:000297590100009,10.1093/aje/kwr253,MEDLINE:22038104,Assessment of Differential Item Functioning in the Experiences of Discrimination Index The Coronary Artery Risk Development in Young Adults (CARDIA) Study,https://gateway.webofknowledge.com/gateway/Gateway.cgi?GWVersion=2&SrcAuth=InCites&SrcApp=tsm_test&DestApp=WOS_CPL&DestLinkType=FullRecord&KeyUT=ISI:000297590100009,"Cunningham, Timothy J.; Berkman, Lisa F.; Gortmaker, Steven L.; Kiefe, Catarina I.; Jacobs, David R., Jr.; Seeman, Teresa E.; Kawachi, Ichiro",AMERICAN JOURNAL OF EPIDEMIOLOGY,"PUBLIC, ENVIRONMENTAL & OCCUPATIONAL HEALTH",Article,174,11,1266-1274,2011,9,42.996599,19.48,0.21,0.4619,55.5464,4.526
WOS:000295122300007,10.1097/PSY.0b013e318228c820,MEDLINE:21810898,Childhood Family Psychosocial Environment and Coronary Heart Disease Risk,https://gateway.webofknowledge.com/gateway/Gateway.cgi?GWVersion=2&SrcAuth=InCites&SrcApp=tsm_test&DestApp=WOS_CPL&DestLinkType=FullRecord&KeyUT=ISI:000295122300007,"Loucks, Eric B.; Almeida, Nisha D.; Taylor, Shelley E.; Matthews, Karen A.",PSYCHOSOMATIC MEDICINE,"PSYCHOLOGY, MULTIDISCIPLINARY; PSYCHOLOGY; PSYCHIATRY",Article,73,7,563-571,2011,31,44.363636,22.73,0.7,1.364,17.6687,3.702
WOS:000286094900018,10.1038/ijo.2010.120,MEDLINE:20548305,Relationship of body mass index in young adulthood and health-related quality of life two decades later: the Coronary Artery Risk Development in Young Adults study,https://gateway.webofknowledge.com/gateway/Gateway.cgi?GWVersion=2&SrcAuth=InCites&SrcApp=tsm_test&DestApp=WOS_CPL&DestLinkType=FullRecord&KeyUT=ISI:000286094900018,"Kozak, A. T.; Daviglus, M. L.; Chan, C.; Kiefe, C. I.; Jacobs, D. R., Jr.; Liu, K.",INTERNATIONAL JOURNAL OF OBESITY,NUTRITION & DIETETICS; ENDOCRINOLOGY & METABOLISM,Article,35,1,134-141,2011,23,37.2,27.1,0.62,0.8488,36.1757,4.419
WOS:000292725000007,10.1038/jhh.2010.94,MEDLINE:20944660,SNP-by-fitness and SNP-by-BMI interactions from seven candidate genes and incident hypertension after 20 years of follow-up: the CARDIA Fitness Study,https://gateway.webofknowledge.com/gateway/Gateway.cgi?GWVersion=2&SrcAuth=InCites&SrcApp=tsm_test&DestApp=WOS_CPL&DestLinkType=FullRecord&KeyUT=ISI:000292725000007,"Sarzynski, M. A.; Rankinen, T.; Sternfeld, B.; Fornage, M.; Sidney, S.; Bouchard, C.",JOURNAL OF HUMAN HYPERTENSION,PERIPHERAL VASCULAR DISEASE,Article,25,8,509-518,2011,5,14.402299,31.17,0.35,0.1604,82.079,2.26
WOS:000290141600006,10.1016/j.envres.2011.01.016,MEDLINE:21316044,Distribution of toenail selenium levels in young adult Caucasians and African Americans in the United States: The CARDIA Trace Element Study,https://gateway.webofknowledge.com/gateway/Gateway.cgi?GWVersion=2&SrcAuth=InCites&SrcApp=tsm_test&DestApp=WOS_CPL&DestLinkType=FullRecord&KeyUT=ISI:000290141600006,"Xun, Pengcheng; Bujnowski, Deborah; Liu, Kiang; Morris, J. Steve; Guo, Zhongqin; He, Ka",ENVIRONMENTAL RESEARCH,"PUBLIC, ENVIRONMENTAL & OCCUPATIONAL HEALTH; ENVIRONMENTAL SCIENCES",Article,111,4,514-519,2011,13,37.017544,23.12,0.35,0.5624,42.9785,5.715
WOS:000290419200023,10.2337/dc10-2041,MEDLINE:21478463,Are the 2005 Dietary Guidelines for Americans Associated With Reduced Risk of Type 2 Diabetes and Cardiometabolic Risk Factors? Twenty-year findings from the CARDIA study,https://gateway.webofknowledge.com/gateway/Gateway.cgi?GWVersion=2&SrcAuth=InCites&SrcApp=tsm_test&DestApp=WOS_CPL&DestLinkType=FullRecord&KeyUT=ISI:000290419200023,"Zamora, Daisy; Gordon-Larsen, Penny; He, Ka; Jacors, David R., Jr.; Shikany, James M.; Popkin, Barry M.",DIABETES CARE,ENDOCRINOLOGY & METABOLISM,Article,34,5,1183-1185,2011,25,64.982558,29.48,0.38,0.8481,36.4795,16.019
