Accession_Number,DOI,Pubmed_ID,Article_Title,Link,Authors,Source,Research_Area,Document Type,Volume,Issue,Pages,Publication_Date,Times_Cited,Journal_Expected_Citations,Category_Expected_Citations,Journal_Normalized_Citation_Impact,Category_Normalized_Citation_Impact,Percentile_in_Subject_Area,Journal_Impact_Factor
WOS:000233478800014,10.1016/j.ahj.2005.04.016,MEDLINE:16290964,Cocaine and coronary calcification in young adults: The Coronary Artery Risk Development in Young Adults (CARDIA) study,https://gateway.webofknowledge.com/gateway/Gateway.cgi?GWVersion=2&SrcAuth=InCites&SrcApp=tsm_test&DestApp=WOS_CPL&DestLinkType=FullRecord&KeyUT=ISI:000233478800014,"Pletcher, MJ; Kiefe, CI; Sidney, S; Carr, JJ; Lewis, CE; Hulley, SB",AMERICAN HEART JOURNAL,CARDIAC & CARDIOVASCULAR SYSTEMS,Article,150,5,921-926,2005,12,43.64433,41.59,0.27,0.2885,61.0424,4.153
WOS:000225991100022,10.1373/clinchem.2004.037630,MEDLINE:15514100,Plasma F-2-isoprostanes and coronary artery calcification: The CARDIA study,https://gateway.webofknowledge.com/gateway/Gateway.cgi?GWVersion=2&SrcAuth=InCites&SrcApp=tsm_test&DestApp=WOS_CPL&DestLinkType=FullRecord&KeyUT=ISI:000225991100022,"Gross, M; Steffes, M; Jacobs, DR; Yu, XH; Lewis, L; Lewis, CE; Loria, CM",CLINICAL CHEMISTRY,MEDICAL LABORATORY TECHNOLOGY,Article,51,1,125-131,2005,93,45.544503,22.27,2.04,4.1768,3.1557,7.292
WOS:000228978900017,10.1093/ije/dyh381,MEDLINE:15659475,Socioeconomic status and health: is parasympathetic nervous system activity an intervening mechanism?,https://gateway.webofknowledge.com/gateway/Gateway.cgi?GWVersion=2&SrcAuth=InCites&SrcApp=tsm_test&DestApp=WOS_CPL&DestLinkType=FullRecord&KeyUT=ISI:000228978900017,"Sloan, RP; Huang, MH; Sidney, S; Liu, K; Williams, OD; Seeman, T",INTERNATIONAL JOURNAL OF EPIDEMIOLOGY,"PUBLIC, ENVIRONMENTAL & OCCUPATIONAL HEALTH",Article,34,2,309-315,2005,24,71.727273,36.6,0.33,0.6558,43.0854,7.707
WOS:000226213100026,10.1016/S0140-6736(04)17663-0,MEDLINE:15639678,"Fast-food habits, weight gain, and insulin resistance (the CARDIA study): 15-year prospective analysis",https://gateway.webofknowledge.com/gateway/Gateway.cgi?GWVersion=2&SrcAuth=InCites&SrcApp=tsm_test&DestApp=WOS_CPL&DestLinkType=FullRecord&KeyUT=ISI:000226213100026,"Pereira, MA; Kartashov, AI; Ebbeling, CB; Van Horn, L; Slattery, M; Jacobs, DR; Ludwig, DS",LANCET,ENDOCRINOLOGY & METABOLISM,Article,365,9453,36-42,2005,707,304.216138,47.07,2.32,15.0214,0.1957,60.392
WOS:000230281900011,10.1016/j.metabol.2005.02.005,MEDLINE:15988700,Inverse effects of the PPAR gamma 2 Pro12Ala polymorphism on measures of adiposity over 15 years in African Americans and whites - The CARDIA study,https://gateway.webofknowledge.com/gateway/Gateway.cgi?GWVersion=2&SrcAuth=InCites&SrcApp=tsm_test&DestApp=WOS_CPL&DestLinkType=FullRecord&KeyUT=ISI:000230281900011,"Fornage, M; Jacobs, DR; Steffes, MW; Gross, MD; Bray, MS; Schreiner, PJ",METABOLISM-CLINICAL AND EXPERIMENTAL,ENDOCRINOLOGY & METABOLISM,Article,54,7,910-917,2005,21,31.898785,47.07,0.66,0.4462,58.9368,6.159
WOS:000230101200015,10.1373/clinchem.2004.045872,MEDLINE:15890893,Serum gamma-glutamyltransferase was differently associated with microalbuminuria by status of hypertension or diabetes: The coronary artery risk development in young adults (CARDIA) study,https://gateway.webofknowledge.com/gateway/Gateway.cgi?GWVersion=2&SrcAuth=InCites&SrcApp=tsm_test&DestApp=WOS_CPL&DestLinkType=FullRecord&KeyUT=ISI:000230101200015,"Lee, DH; Jacobs, DR; Gross, M; Steffes, M",CLINICAL CHEMISTRY,MEDICAL LABORATORY TECHNOLOGY,Article,51,7,1185-1191,2005,47,45.544503,22.27,1.03,2.1109,10.4051,7.292
WOS:000227450900019,10.1194/jlr.M400437-JLR200,MEDLINE:15604515,"APOA5 polymorphisms influence plasma triglycerides in young, healthy African Americans and whites of the CARDIA Study",https://gateway.webofknowledge.com/gateway/Gateway.cgi?GWVersion=2&SrcAuth=InCites&SrcApp=tsm_test&DestApp=WOS_CPL&DestLinkType=FullRecord&KeyUT=ISI:000227450900019,"Klos, KLE; Hamon, S; Clark, AG; Boerwinkle, E; Liu, K; Sing, CF",JOURNAL OF LIPID RESEARCH,BIOCHEMISTRY & MOLECULAR BIOLOGY,Article,46,3,564-570,2005,46,54.32971,54.2,0.85,0.8487,33.3846,4.483
WOS:000233926700005,n/a,MEDLINE:16332648,"Associations of plant food, dairy product, and meat intakes with 15-y incidence of elevated blood pressure in young black and white adults: the Coronary Artery Risk Development in Young Adults (CARDIA) Study",https://gateway.webofknowledge.com/gateway/Gateway.cgi?GWVersion=2&SrcAuth=InCites&SrcApp=tsm_test&DestApp=WOS_CPL&DestLinkType=FullRecord&KeyUT=ISI:000233926700005,"Steffen, LM; Kroenke, CH; Yu, XH; Pereira, MA; Slattery, ML; Van Horn, L; Gross, MD; Jacobs, DR",AMERICAN JOURNAL OF CLINICAL NUTRITION,NUTRITION & DIETETICS,Article,82,6,1169-1177,2005,189,108.802857,44.94,1.74,4.2058,3.4275,6.766
WOS:000226065900036,10.1161/01.ATV.0000148322.89911.44,MEDLINE:15499045,Association of lipoprotein-associated phospholipase A(2) mass and activity with calcified coronary plaque in young adults - The CARDIA study,https://gateway.webofknowledge.com/gateway/Gateway.cgi?GWVersion=2&SrcAuth=InCites&SrcApp=tsm_test&DestApp=WOS_CPL&DestLinkType=FullRecord&KeyUT=ISI:000226065900036,"Iribarren, C; Gross, MD; Darbinian, JA; Jacobs, DR; Sidney, S; Loria, CM",ARTERIOSCLEROSIS THROMBOSIS AND VASCULAR BIOLOGY,HEMATOLOGY; PERIPHERAL VASCULAR DISEASE,Article,25,1,216-221,2005,87,77.69914,49.22,1.12,1.7676,13.8856,6.604
WOS:000226404000003,10.1016/j.socscimed.2004.06.007,MEDLINE:15550296,"Causes and demographic, medical, lifestyle and psychosocial predictors of premature mortality: the CARDIA study",https://gateway.webofknowledge.com/gateway/Gateway.cgi?GWVersion=2&SrcAuth=InCites&SrcApp=tsm_test&DestApp=WOS_CPL&DestLinkType=FullRecord&KeyUT=ISI:000226404000003,"Iribarren, C; Jacobs, DR; Kiefe, CI; Lewis, CE; Matthews, KA; Roseman, JM; Hulley, SB",SOCIAL SCIENCE & MEDICINE,"PUBLIC, ENVIRONMENTAL & OCCUPATIONAL HEALTH; SOCIAL SCIENCES, BIOMEDICAL",Article,60,3,471-482,2005,35,63.211838,39.34,0.55,0.8897,29.9783,3.616
WOS:000230766000018,10.1373/clinchem.2004.044859,MEDLINE:15951317,The uncoupling protein 2 Ala55Val polymorphism is associated with diabetes mellitus: The CARDIA study,https://gateway.webofknowledge.com/gateway/Gateway.cgi?GWVersion=2&SrcAuth=InCites&SrcApp=tsm_test&DestApp=WOS_CPL&DestLinkType=FullRecord&KeyUT=ISI:000230766000018,"Yu, XH; Jacobs, DR; Schreiner, PJ; Gross, MD; Steffes, MW; Fornage, M",CLINICAL CHEMISTRY,MEDICAL LABORATORY TECHNOLOGY,Article,51,8,1451-1456,2005,34,45.544503,22.27,0.75,1.527,18.4648,7.292
WOS:000228540400011,10.1007/s00439-005-1258-3,MEDLINE:15744522,Matrix Gla protein and osteopontin genetic associations with coronary artery calcification and bone density: the CARDIA study,https://gateway.webofknowledge.com/gateway/Gateway.cgi?GWVersion=2&SrcAuth=InCites&SrcApp=tsm_test&DestApp=WOS_CPL&DestLinkType=FullRecord&KeyUT=ISI:000228540400011,"Taylor, BC; Schreiner, PJ; Doherty, TM; Fornage, M; Carr, JJ; Sidney, S",HUMAN GENETICS,GENETICS & HEREDITY,Article,116,6,525-528,2005,34,37.043478,48.96,0.92,0.6944,40.6194,5.743
WOS:000234548200007,10.1207/s15327914nc5301_7,MEDLINE:16351507,"IGF-1, IGFBP-3, and nutritional factors in young black and white men: The CARDIA male hormone study",https://gateway.webofknowledge.com/gateway/Gateway.cgi?GWVersion=2&SrcAuth=InCites&SrcApp=tsm_test&DestApp=WOS_CPL&DestLinkType=FullRecord&KeyUT=ISI:000234548200007,"Colangelo, LA; Chin, BCH; Liu, K; Kopp, PA; Gann, PH; Gapstur, SM",NUTRITION AND CANCER-AN INTERNATIONAL JOURNAL,NUTRITION & DIETETICS; ONCOLOGY,Article,53,1,57-64,2005,9,30.946667,49.4,0.29,0.1822,77.4476,2.363
WOS:000238537400017,n/a,MEDLINE:16728422,The temporal relationship between heart rate recovery immediately after exercise and the metabolic syndrome: the CARDIA study,https://gateway.webofknowledge.com/gateway/Gateway.cgi?GWVersion=2&SrcAuth=InCites&SrcApp=tsm_test&DestApp=WOS_CPL&DestLinkType=FullRecord&KeyUT=ISI:000238537400017,"Ali Kizilbash, Mohammad; Carnethon, Mercedes R.; Chan, Cheeling; Jacobs, David R.; Sidney, Stephen; Liu, Kiang",EUROPEAN HEART JOURNAL,CARDIAC & CARDIOVASCULAR SYSTEMS,Article,27,13,1592-1596,2006,48,92.132931,39.13,0.52,1.2268,22.1834,22.673
WOS:000236540700010,10.1161/CIRCULATIONAHA.105.588327,MEDLINE:16567569,Magnesium intake and incidence of metabolic syndrome among young adults,https://gateway.webofknowledge.com/gateway/Gateway.cgi?GWVersion=2&SrcAuth=InCites&SrcApp=tsm_test&DestApp=WOS_CPL&DestLinkType=FullRecord&KeyUT=ISI:000236540700010,"He, K; Liu, K; Daviglus, ML; Morris, SJ; Loria, CM; Van Horn, L; Jacobs, DR; Savage, PJ",CIRCULATION,CARDIAC & CARDIOVASCULAR SYSTEMS; PERIPHERAL VASCULAR DISEASE,Article,113,13,1675-1682,2006,186,151.996845,42.64,1.22,4.3623,3.063,23.603
WOS:000235943900006,10.1207/s15327558ijbm1301_6,MEDLINE:16503840,"History of depression, race, and cardiovascular risk in CARDIA",https://gateway.webofknowledge.com/gateway/Gateway.cgi?GWVersion=2&SrcAuth=InCites&SrcApp=tsm_test&DestApp=WOS_CPL&DestLinkType=FullRecord&KeyUT=ISI:000235943900006,"Knox, S; Barnes, A; Kiefe, C; Lewis, CE; Iribarren, C; Matthews, KA; Wong, ND; Whooley, M",INTERNATIONAL JOURNAL OF BEHAVIORAL MEDICINE,"PSYCHOLOGY, CLINICAL",Article,13,1,44-50,2006,15,24.076923,37.68,0.62,0.3981,61.2516,2.139
WOS:000238448000019,10.1038/oby.2006.41,MEDLINE:16571859,"Adiponectin, visceral fat, oxidative stress, and early macrovascular disease: The coronary artery risk development in young adults study",https://gateway.webofknowledge.com/gateway/Gateway.cgi?GWVersion=2&SrcAuth=InCites&SrcApp=tsm_test&DestApp=WOS_CPL&DestLinkType=FullRecord&KeyUT=ISI:000238448000019,"Steffes, Michael W.; Gross, Myron D.; Lee, Duk-Hee; Schreiner, Pamela J.; Jacobs, David R., Jr.",OBESITY,NUTRITION & DIETETICS; ENDOCRINOLOGY & METABOLISM,Article,14,2,319-326,2006,44,56.730769,42.61,0.78,1.0325,29.0551,3.742
WOS:000239391400022,10.1161/01.ATV.0000231523.19199.45,MEDLINE:16763159,Consistent effects of genes involved in reverse cholesterol transport on plasma lipid and apolipoprotein levels in CARDIA participants,https://gateway.webofknowledge.com/gateway/Gateway.cgi?GWVersion=2&SrcAuth=InCites&SrcApp=tsm_test&DestApp=WOS_CPL&DestLinkType=FullRecord&KeyUT=ISI:000239391400022,"Klos, Kathy L. E.; Sing, Charles F.; Boerwinkle, Eric; Hamon, Sara C.; Rea, Thomas J.; Clark, Andrew; Fornage, Myriam; Hixson, James E.",ARTERIOSCLEROSIS THROMBOSIS AND VASCULAR BIOLOGY,HEMATOLOGY; PERIPHERAL VASCULAR DISEASE,Article,26,8,1828-1836,2006,35,66.391304,46.16,0.53,0.7582,37.1003,6.604
WOS:000241205700003,10.1097/01.psy.0000244071.42939.0e,MEDLINE:17012518,Diurnal cortisol decline is related to coronary calcification: CARDIA study,https://gateway.webofknowledge.com/gateway/Gateway.cgi?GWVersion=2&SrcAuth=InCites&SrcApp=tsm_test&DestApp=WOS_CPL&DestLinkType=FullRecord&KeyUT=ISI:000241205700003,"Matthews, Karen; Schwartz, Joseph; Cohen, Sheldon; Seeman, Teresa",PSYCHOSOMATIC MEDICINE,"PSYCHOLOGY; PSYCHOLOGY, MULTIDISCIPLINARY; PSYCHIATRY",Article,68,5,657-661,2006,162,59.412698,37.02,2.73,4.3759,2.9332,3.702
WOS:000239875800001,10.1016/j.socscimed.2006.04.008,MEDLINE:16750286,"Self-reported health, perceived racial discrimination, and skin color in African Americans in the CARDIA study",https://gateway.webofknowledge.com/gateway/Gateway.cgi?GWVersion=2&SrcAuth=InCites&SrcApp=tsm_test&DestApp=WOS_CPL&DestLinkType=FullRecord&KeyUT=ISI:000239875800001,"Borrell, Luisa N.; Kiefe, Catarina I.; Williams, David R.; Diez-Roux, Ana V.; Gordon-Larsen, Penny",SOCIAL SCIENCE & MEDICINE,"SOCIAL SCIENCES, BIOMEDICAL; PUBLIC, ENVIRONMENTAL & OCCUPATIONAL HEALTH",Article,63,6,1415-1427,2006,180,53.997167,32.94,3.33,5.4644,1.491,3.616
WOS:000241589100008,10.1007/s00109-006-0088-7,MEDLINE:16955276,Patterns of association between PPAR gamma genetic variation and indices of adiposity and insulin action in African-Americans and whites: the CARDIA Study,https://gateway.webofknowledge.com/gateway/Gateway.cgi?GWVersion=2&SrcAuth=InCites&SrcApp=tsm_test&DestApp=WOS_CPL&DestLinkType=FullRecord&KeyUT=ISI:000241589100008,"Wei, Qi; Jacobs, David R., Jr.; Schreiner, Pamela J.; Siscovick, David S.; Steffes, Michael W.; Fornage, Myriam",JOURNAL OF MOLECULAR MEDICINE-JMM,"MEDICINE, RESEARCH & EXPERIMENTAL; GENETICS & HEREDITY",Article,84,11,955-965,2006,14,36.987342,41.51,0.38,0.3373,54.6421,4.427
WOS:000239656200005,10.1007/s00109-005-0037-x,MEDLINE:16705465,The contribution of individual and pairwise combinations of SNPs in the APOA1 and APOC3 genes to interindividual HDL-C variability,https://gateway.webofknowledge.com/gateway/Gateway.cgi?GWVersion=2&SrcAuth=InCites&SrcApp=tsm_test&DestApp=WOS_CPL&DestLinkType=FullRecord&KeyUT=ISI:000239656200005,"Brown, C. M.; Rea, T. J.; Hamon, S. C.; Hixson, J. E.; Boerwinkle, E.; Clark, A. G.; Sing, C. F.",JOURNAL OF MOLECULAR MEDICINE-JMM,"MEDICINE, RESEARCH & EXPERIMENTAL; GENETICS & HEREDITY",Article,84,7,561-572,2006,20,36.987342,41.51,0.54,0.4818,42.9101,4.427
WOS:000242312700007,10.1001/archinte.166.21.2341,MEDLINE:17130387,Prediction of coronary artery calcium in young adults using the Pathobiological Determinants of Atherosclerosis in Youth (PDAY) risk score - The CARDIA study,https://gateway.webofknowledge.com/gateway/Gateway.cgi?GWVersion=2&SrcAuth=InCites&SrcApp=tsm_test&DestApp=WOS_CPL&DestLinkType=FullRecord&KeyUT=ISI:000242312700007,"Gidding, Samuel S.; McMahan, Alex; McGill, Henry C.; Colangelo, Laura A.; Schreiner, Pamela J.; Williams, O. Dale; Liu, Kiang",ARCHIVES OF INTERNAL MEDICINE,CARDIAC & CARDIOVASCULAR SYSTEMS,Article,166,21,2341-2347,2006,64,126.935115,39.13,0.5,1.6357,15.9289,n/a
WOS:000241264100007,10.1016/j.biopsych.2006.03.016,MEDLINE:16712805,Relationship of early life stress and psychological functioning to adult C-reactive protein in the coronary artery risk development in young adults study,https://gateway.webofknowledge.com/gateway/Gateway.cgi?GWVersion=2&SrcAuth=InCites&SrcApp=tsm_test&DestApp=WOS_CPL&DestLinkType=FullRecord&KeyUT=ISI:000241264100007,"Taylor, Shelley E.; Lehman, Barbara J.; Kiefe, Catarina I.; Seeman, Teresa E.",BIOLOGICAL PSYCHIATRY,PSYCHIATRY; NEUROSCIENCES,Article,60,8,819-824,2006,192,100.36014,45.55,1.91,4.2155,2.8001,12.095
WOS:000238536900002,10.1093/aje/kwj199,MEDLINE:16740591,Objectively measured sleep characteristics among early-middle-aged adults - The CARDIA study,https://gateway.webofknowledge.com/gateway/Gateway.cgi?GWVersion=2&SrcAuth=InCites&SrcApp=tsm_test&DestApp=WOS_CPL&DestLinkType=FullRecord&KeyUT=ISI:000238536900002,"Lauderdale, Diane S.; Knutson, Kristen L.; Yan, Lijing L.; Rathouz, Paul J.; Hulley, Stephen B.; Sidney, Steve; Liu, Kiang",AMERICAN JOURNAL OF EPIDEMIOLOGY,"PUBLIC, ENVIRONMENTAL & OCCUPATIONAL HEALTH",Article,164,1,16-May,2006,350,77.142276,33.34,4.54,10.499,0.3924,4.526
WOS:000239851900005,10.1002/gepi.20163,MEDLINE:16800005,Contrasting multi-site genotypic distributions among discordant quantitative phenotypes: The APOA1/C3/A4/A5 gene cluster and cardiovascular disease risk factors,https://gateway.webofknowledge.com/gateway/Gateway.cgi?GWVersion=2&SrcAuth=InCites&SrcApp=tsm_test&DestApp=WOS_CPL&DestLinkType=FullRecord&KeyUT=ISI:000239851900005,"Payseur, Bret A.; Clark, Andrew G.; Hixson, James; Boerwinkle, Eric; Sing, Charles F.",GENETIC EPIDEMIOLOGY,MATHEMATICAL & COMPUTATIONAL BIOLOGY; GENETICS & HEREDITY,Article,30,6,508-518,2006,3,20.412698,45.88,0.15,0.0654,90.199,1.954
WOS:000236886900022,10.1001/jama.295.15.1793,MEDLINE:16622141,"Education, 15-year risk factor progression, and coronary artery calcium in young adulthood and early middle age - The Coronary Artery Risk Development in Young Adults study",https://gateway.webofknowledge.com/gateway/Gateway.cgi?GWVersion=2&SrcAuth=InCites&SrcApp=tsm_test&DestApp=WOS_CPL&DestLinkType=FullRecord&KeyUT=ISI:000236886900022,"Yan, LJL; Liu, K; Daviglus, ML; Colangelo, LA; Kiefe, CI; Sidney, S; Matthews, KA; Greenland, P",JAMA-JOURNAL OF THE AMERICAN MEDICAL ASSOCIATION,"PUBLIC, ENVIRONMENTAL & OCCUPATIONAL HEALTH",Article,295,15,1793-1800,2006,64,327.940171,33.34,0.2,1.9198,12.7413,45.54
WOS:000237319100008,10.1093/aje/kwj136,MEDLINE:16597706,Associations of serum carotenoid concentrations with the development of diabetes and with insulin concentration: Interaction with smoking - The Coronary Artery Risk Development in Young Adults (CARDIA) Study,https://gateway.webofknowledge.com/gateway/Gateway.cgi?GWVersion=2&SrcAuth=InCites&SrcApp=tsm_test&DestApp=WOS_CPL&DestLinkType=FullRecord&KeyUT=ISI:000237319100008,"Hozawa, A; Jacobs, DR; Steffes, MW; Gross, MD; Steffen, LM; Lee, DH",AMERICAN JOURNAL OF EPIDEMIOLOGY,"PUBLIC, ENVIRONMENTAL & OCCUPATIONAL HEALTH",Article,163,10,929-937,2006,68,77.142276,33.34,0.88,2.0398,11.4184,4.526
WOS:000238357100004,10.1159/000093384,MEDLINE:16710093,Evidence for consistent intragenic and intergenic interactions between SNP effects in the APOA1/C3/A4/A5 gene cluster,https://gateway.webofknowledge.com/gateway/Gateway.cgi?GWVersion=2&SrcAuth=InCites&SrcApp=tsm_test&DestApp=WOS_CPL&DestLinkType=FullRecord&KeyUT=ISI:000238357100004,"Hamon, Sara C.; Kardia, Sharon L. R.; Boerwinkle, Eric; Liu, Kiang; Klos, Kathy L. E.; Clark, Andrew G.; Sing, Charles F.",HUMAN HEREDITY,GENETICS & HEREDITY,Article,61,2,87-96,2006,34,25.933333,46.92,1.31,0.7247,38.4351,0.444
WOS:000235372300021,10.1161/01.HYP.0000200713.44895.38,MEDLINE:16446400,Blood pressure reactivity to psychological stress and coronary calcification in the coronary artery risk development in young adults study,https://gateway.webofknowledge.com/gateway/Gateway.cgi?GWVersion=2&SrcAuth=InCites&SrcApp=tsm_test&DestApp=WOS_CPL&DestLinkType=FullRecord&KeyUT=ISI:000235372300021,"Matthews, KA; Zhu, S; Tucker, DC; Whooley, MA",HYPERTENSION,PERIPHERAL VASCULAR DISEASE,Article,47,3,391-395,2006,105,74.448399,46.84,1.41,2.2416,10.9417,7.713
WOS:000242714800005,10.1093/aje/kwj334,MEDLINE:17038418,Cardiovascular disease risk factor knowledge in young adults and 10-year change in risk factors - The coronary artery risk development in young adults (CARDIA) study,https://gateway.webofknowledge.com/gateway/Gateway.cgi?GWVersion=2&SrcAuth=InCites&SrcApp=tsm_test&DestApp=WOS_CPL&DestLinkType=FullRecord&KeyUT=ISI:000242714800005,"Lynch, Elizabeth B.; Liu, Kiang; Kiefe, Catarina I.; Greenland, Philip",AMERICAN JOURNAL OF EPIDEMIOLOGY,"PUBLIC, ENVIRONMENTAL & OCCUPATIONAL HEALTH",Article,164,12,1171-1179,2006,35,77.142276,33.34,0.45,1.0499,28.5524,4.526
WOS:000234936500007,10.1097/01.psy.0000195967.51768.ea,MEDLINE:16449410,"Socioeconomic status, race, and diurnal cortisol decline in the Coronary Artery Risk Development in Young Adults (CARDIA) Study",https://gateway.webofknowledge.com/gateway/Gateway.cgi?GWVersion=2&SrcAuth=InCites&SrcApp=tsm_test&DestApp=WOS_CPL&DestLinkType=FullRecord&KeyUT=ISI:000234936500007,"Cohen, S; Schwartz, JE; Epel, E; Kirschbaum, C; Sidney, S; Seeman, T",PSYCHOSOMATIC MEDICINE,"PSYCHOLOGY; PSYCHOLOGY, MULTIDISCIPLINARY; PSYCHIATRY",Article,68,1,41-50,2006,257,59.412698,37.02,4.33,6.9421,0.8413,3.702
WOS:000237518400017,10.1136/bmj.38779.584028.55,MEDLINE:16603565,Active and passive smoking and development of glucose intolerance among young adults in a prospective cohort: CARDIA study,https://gateway.webofknowledge.com/gateway/Gateway.cgi?GWVersion=2&SrcAuth=InCites&SrcApp=tsm_test&DestApp=WOS_CPL&DestLinkType=FullRecord&KeyUT=ISI:000237518400017,"Houston, TK; Person, SD; Pletcher, MJ; Liu, K; Iribarren, C; Kiefe, CI",BRITISH MEDICAL JOURNAL,"PUBLIC, ENVIRONMENTAL & OCCUPATIONAL HEALTH",Article,332,7549,1064-1067,2006,123,83.426966,33.34,1.47,3.6896,4.0003,n/a
WOS:000235288700012,10.1001/archinte.166.3.345,MEDLINE:16476876,C-reactive protein concentration and incident hypertension in young adults - The CARDIA study,https://gateway.webofknowledge.com/gateway/Gateway.cgi?GWVersion=2&SrcAuth=InCites&SrcApp=tsm_test&DestApp=WOS_CPL&DestLinkType=FullRecord&KeyUT=ISI:000235288700012,"Lakoski, SG; Herrington, DM; Siscovick, DM; Hulley, SB",ARCHIVES OF INTERNAL MEDICINE,PERIPHERAL VASCULAR DISEASE,Article,166,3,345-349,2006,60,126.935115,46.84,0.47,1.2809,22.6009,n/a
WOS:000237597900019,10.1111/j.1538-7836.2006.01907.x,MEDLINE:16706972,Association between patterns of nucleotide variation across the three fibrinogen genes and plasma fibrinogen levels: the Coronary Artery Risk Development in Young Adults (CARDIA) study,https://gateway.webofknowledge.com/gateway/Gateway.cgi?GWVersion=2&SrcAuth=InCites&SrcApp=tsm_test&DestApp=WOS_CPL&DestLinkType=FullRecord&KeyUT=ISI:000237597900019,"Reiner, AP; Carty, CL; Carlson, CS; Wan, JY; Rieder, MJ; Smith, JD; Rice, K; Fornage, M; Jaquish, CE; Williams, OD; Tracy, RP; Lewis, CE; Siscovick, DS; Boerwinkle, E; Nickerson, DA",JOURNAL OF THROMBOSIS AND HAEMOSTASIS,HEMATOLOGY; PERIPHERAL VASCULAR DISEASE,Article,4,6,1279-1287,2006,40,45.453608,46.16,0.88,0.8665,33.043,4.157
WOS:000240939300031,10.1093/ije/dyl049,MEDLINE:16554379,Plasma fibrinogen and lung function: the CARDIA study,https://gateway.webofknowledge.com/gateway/Gateway.cgi?GWVersion=2&SrcAuth=InCites&SrcApp=tsm_test&DestApp=WOS_CPL&DestLinkType=FullRecord&KeyUT=ISI:000240939300031,"Thyagarajan, Bharat; Jacobs, David R.; Apostol, George G.; Smith, Lewis J.; Lewis, Cora E.; Williams, O. Dale",INTERNATIONAL JOURNAL OF EPIDEMIOLOGY,"PUBLIC, ENVIRONMENTAL & OCCUPATIONAL HEALTH",Article,35,4,1001-1008,2006,59,71.257353,33.34,0.83,1.7698,14.33,7.707
WOS:000242181700024,10.1093/sleep/29.11.1503,MEDLINE:17162998,Stability of the Pittsburgh sleep quality index and the epworth sleepiness questionnaires over 1 year in early middle-aged adults: The CARDIA study,https://gateway.webofknowledge.com/gateway/Gateway.cgi?GWVersion=2&SrcAuth=InCites&SrcApp=tsm_test&DestApp=WOS_CPL&DestLinkType=FullRecord&KeyUT=ISI:000242181700024,"Knutson, Kristen L.; Rathouz, Paul J.; Yan, Lijing L.; Liu, Kiang; Lauderdale, Diane S.",SLEEP,CLINICAL NEUROLOGY; NEUROSCIENCES,Article,29,11,1503-1506,2006,89,66.161074,42.09,1.35,2.1143,8.7327,4.805
WOS:000240730500018,10.1001/archinte.166.17.1915,MEDLINE:17000950,"Menthol cigarettes, smoking cessation, atherosclerosis, and pulmonary function - The Coronary Artery Risk Development in Young Adults (CARDIA) Study",https://gateway.webofknowledge.com/gateway/Gateway.cgi?GWVersion=2&SrcAuth=InCites&SrcApp=tsm_test&DestApp=WOS_CPL&DestLinkType=FullRecord&KeyUT=ISI:000240730500018,"Pletcher, Mark J.; Hulley, Benjamin J.; Houston, Thomas; Kiefe, Catarina I.; Benowitz, Neal; Sidney, Stephen",ARCHIVES OF INTERNAL MEDICINE,"PUBLIC, ENVIRONMENTAL & OCCUPATIONAL HEALTH",Article,166,17,1915-1922,2006,89,126.935115,33.34,0.7,2.6697,7.2093,n/a
WOS:000240063200012,10.1038/sj.ijo.0803307,MEDLINE:16534519,Changes in risk factors for cardiovascular disease by baseline weight status in young adults who maintain or gain weight over 15 years: the CARDIA study,https://gateway.webofknowledge.com/gateway/Gateway.cgi?GWVersion=2&SrcAuth=InCites&SrcApp=tsm_test&DestApp=WOS_CPL&DestLinkType=FullRecord&KeyUT=ISI:000240063200012,"Truesdale, K. P.; Stevens, J.; Lewis, C. E.; Schreiner, P. J.; Loria, C. M.; Cai, J.",INTERNATIONAL JOURNAL OF OBESITY,NUTRITION & DIETETICS; ENDOCRINOLOGY & METABOLISM,Article,30,9,1397-1407,2006,89,55.902622,42.61,1.59,2.0885,10.1903,4.419
WOS:000235234700020,10.1079/BJN20051638,MEDLINE:16469154,Longitudinal associations between body mass index and serum carotenoids: the CARDIA study,https://gateway.webofknowledge.com/gateway/Gateway.cgi?GWVersion=2&SrcAuth=InCites&SrcApp=tsm_test&DestApp=WOS_CPL&DestLinkType=FullRecord&KeyUT=ISI:000235234700020,"Andersen, LF; Jacobs, DR; Gross, MD; Schreiner, PJ; Williams, OD; Lee, DH",BRITISH JOURNAL OF NUTRITION,NUTRITION & DIETETICS,Article,95,2,358-365,2006,56,36.009524,40.01,1.56,1.3996,21.5737,3.334
WOS:000241747000010,10.1016/j.drugalcdep.2006.04.011,MEDLINE:16723193,Incidence and antecedents of nonmedical prescription opioid use in four US communities - The Coronary Artery Risk Development in Young Adults (CARDIA) prospective cohort study,https://gateway.webofknowledge.com/gateway/Gateway.cgi?GWVersion=2&SrcAuth=InCites&SrcApp=tsm_test&DestApp=WOS_CPL&DestLinkType=FullRecord&KeyUT=ISI:000241747000010,"Pletcher, Mark J.; Kertesz, Stefan G.; Sidney, Stephen; Kiefe, Catarina I.; Hulley, Stephen B.",DRUG AND ALCOHOL DEPENDENCE,PSYCHIATRY; SUBSTANCE ABUSE,Article,85,2,171-176,2006,16,48.284211,37.17,0.33,0.4305,61.0331,3.951
WOS:000236421200007,10.1016/j.ypmed.2005.12.008,MEDLINE:16480762,The association of cigarette smoking with self-reported disease before middle age: The Coronary Artery Risk Development in Young Adults (CARDIA) study,https://gateway.webofknowledge.com/gateway/Gateway.cgi?GWVersion=2&SrcAuth=InCites&SrcApp=tsm_test&DestApp=WOS_CPL&DestLinkType=FullRecord&KeyUT=ISI:000236421200007,"Hozawa, A; Houston, T; Steffes, MW; Widome, R; Williams, OD; Inibarren, C; Pletcher, MJ; Daviglus, ML; Carr, JJ; Jacobs, DR",PREVENTIVE MEDICINE,"PUBLIC, ENVIRONMENTAL & OCCUPATIONAL HEALTH",Article,42,3,193-199,2006,29,34.352113,33.34,0.84,0.8699,35.1668,3.788
WOS:000240039500010,10.1016/j.amjcard.2006.03.024,MEDLINE:16893701,"Marijuana use, diet, body mass index, and cardiovascular risk factors (from the CARDIA Study)",https://gateway.webofknowledge.com/gateway/Gateway.cgi?GWVersion=2&SrcAuth=InCites&SrcApp=tsm_test&DestApp=WOS_CPL&DestLinkType=FullRecord&KeyUT=ISI:000240039500010,"Rodondi, Nicolas; Pletcher, Mark James; Liu, Kiang; Hulley, Stephen Benjamin; Sidney, Stephen",AMERICAN JOURNAL OF CARDIOLOGY,CARDIAC & CARDIOVASCULAR SYSTEMS,Article,98,4,478-484,2006,92,40.521739,39.13,2.27,2.3513,9.8244,2.57
